comment_id,user_name,content
2033102747169842,Nguyễn Hiền,Bà Hằng của mai sau
2034235943723189,Kỳ Anh,Thuỳ Dương Phươg Nguyễnn khi về già ha :))
2034318143714969,Khánh Kitty,Như Uyên Nguyễn nhìn lại mình trông có chán không 🥲
2033085370504913,Như Thoa,Yến Nhi đẹp hok
2033084260505024,Linh America,Hồng Lê nhìn là c nghĩ ngay tới e🤭🤭
2033717297108387,Hivian Nguyen,"Huỳnh Ngân tập từ từ, sau này cũng còn tập mà 👉🏻👈🏻"
2033454087134708,Nguyen Hong Nhat Linh,Thùy Dung ráng nha chị kkkk
2033135553833228,Phương Pancha Pancha,Nghi Lê Hoàng Nga nhìn để học hỏi nè
2033168320496618,SonCa Do,Vy Mai Huynh chị sau này ko? 🤣
2033169290496521,Nguyen Duy Anh,Dieu Anh Nguyen phấn đấu b nhé =)))))))))))))
2033141527165964,Như Ý,Bồ Công Anh gắng lên nha bạn iu 🤣
2033146717165445,Vũ Bảo Loan,Hoài Lúm Hoài khi vìa già 😁
2033105550502895,Mi Lô,Hana Nguyen chị này
2033143607165756,Trần Huyền,Bích Vũ ce m khi về già=)))
2033113570502093,Trang Nguyen,Ngọc Ngân động lực nè
2033453180468132,Bí Ngô,Sẽ phấn đấu như này giờ 50 t rồi
2033137833833000,Dương Thiên Thảo,Lê Thị Thuỳ Linh chị Linh khi về già
2033063770507073,Ngọc Ánh,E nghĩ tới c Moon Trần 🤣
2033151633831620,Khánh Linh,Nguyễn Bích Nguyệt phấn đấu tập đến u60 c nhỉ
2033127080500742,Thu Hằng,Kim Loan Huỳnh tập tới già cho t
2033735680439882,Kiều Trang,Kiều Đoan bà Đoan trong tương lai
2033087040504746,Khánh Linh,Anh Nguyen
2033558907124226,Trina Trang Nguyen,Alice Tang Vannie Duong
2033505030462947,Hồng Ngọc,Thảo Ngô
2033221573824626,Lily Pad,Hoà Nguyễn
2034687310344719,Phương Anh,Joyy
2033527913793992,Bích Hòa,Trà My=))))))))))
2033197487160368,Nguyễn Thúy Diễm,Chi Ngô
2033196293827154,Trần Thùy Trang,Vy Rin
