comment_id,user_name,content
1856670481479737,Nguyễn Thị Thuý Hằng,Tui tự mua máy triệt chân lông n k đen như bác 🥲
1856599981486787,Nguyễn Vũ Hà Lan,Nhưng liệu trình 15b thì k hết đc bạn ơi. Phải bảo hành 1-2 năm
1856599754820143,Nguyễn Vũ Hà Lan,"Sẽ hết nha bạn, hãy kiên trì. Chân tui sau 1 năm triệt mới giảm rõ rệt"
1888371044976347,Lê Bảo Trân,"Tham gia Hội review triệt lông để biết thêm các phương pháp triệt lông an toàn nè b

https://m.facebook.com/groups/807896922727529/?ref=share&mibextid=S66gvF"
1856673534812765,Đức Minh,".
Viêm nang lông, viêm lỗ chân lông - Liệu trình chuyên biệt: xịt 50ml + sữa tắm thảo mộc 500ml MEE NATURAL https://shope.ee/2KxGjtNUau"
1856635781483207,Tô Bảo Châu,Kem dưỡng da sáng mịn https://shope.ee/4fV7iLpbOa
1884639748682810,An Khánh,"E đang xài cái máy triệt Ulike của Hàn ,sau 4lần triệt là sạch lông chân luôn ấy, da mịn ,sáng lắm nha. Đợt e mua bên c Hạnh Lê ấy , chị ấy tv kỹ lưỡng lắm luôn"
1857510901395695,Sandy Mandy,Triệt tại nha lun nè https://shope.ee/2q3W2ZgBNc
1856611104819008,Phương Dung,Tham khảo liệu trình triệt bên mình nha. Cần tìm hiểu thêm thì inb mình nè
1856734564806662,Thuu Hiềnn,Mình cũng 5 buổi triệt mà nó gần hết chân đen rồi :v
1856636664816452,Hà Su,"Em thấy 5 buổi mà vẫn cứng và nhiều như này thì máy triệt chất lượng hơi kém đó ạ, bác kiên trì đi nhiều buổi lên vậy"
1856774921469293,Hạnh Lê,"Tham khảo máy triệt cá nhân dùng tại nhà cho tiện bạn ơi. Dùng máy triệt cá nhân vừa chủ động vừa sạch sẽ, nhẹ nhàng, chi phí rẻ.

Triệt lông là phương pháp tốt nhất nha nhưng triệt thì ko bao giờ vĩnh viễn đc ngoài spa bảo hành thì cũng 2,3 năm thôi, nếu có điều kiện bạn cứ đi spa còn vừa tiền bạn mua máy triệt lông về dùng tiện hơn xài đc từ mặt tới chân mà chủ động nữa.

Mình có đủ các dòng máy triệt lông đang hot nhất hiện nay đang có KHUYẾN MÃI GIẢM GIÁ, các bạn có nhu cầu inbox mình tư vấn nhiệt tình ạ"
1856603711486414,Kiều Linh,Hết nha b. Qtrong b có gặp đc amys xinn sò k thôi nè. Triệt sẽ thấy hiệu quả từng lần triệt á b
1857254271421358,Ngọc Hân,"Mua máy triệt cá nhân đi bạn. Mình triệt Spa đi nhiều lần, đỡ hơn tí. Rồi sau nó mọc lại um tùm luôn. Mua máy triệt duy trì rất tiện luôn nhé. Lông lên thì lấy máy ra triệt dặm lông giảm nhiều lắm á bạn. M đang dùng Ulike của Hàn ok nè, mua bên shop c Hạnh Lê giá tốt, đc take care suốt quá trình sd nhé"
1889183221561796,Thu Quỳnh,"Máy triệt lông lạnh Ulike chính hãng Hàn Quốc đang sale giá siêu tốt kèm áp mã VOUCHER 500k dịp Giáng Sinh các bạn nhanh tay nè.

Em máy này thì siêu HOT luôn rồi xài siêu đỉnh, nhanh tay đặt hàng ở đây
https://shope.ee/5ASnHSzrsX."
