comment_id,user_name,content
2034717130341737,Thiên Hoàng,"Mình nghĩ trước tiên là tẩy run, hiến máu. Sau đó ăn uống bồi bổ cơ thể dễ hấp thu"
2034591683687615,Hồ AnhThư,Nguyễn Hồng Thương tag để đây và k nói gì🥹
2034587777021339,Lưu Trọng Hiệp,"Có ny đi, rồi bạn ấy chăm cho ❤️"
2034676123679171,Seo Yoon,M65 40kg ai cũng chửi 😞🥹🥹
2034929210320529,Hương Phạm,"Ngọc Mai bạn chắc là bị rối loạn tiêu hóa, bổ sung men này tiêu hoa này thg xuyên đi ạ
https://s.shopee.vn/700J7F5utf"
2034577693689014,Hoàng Long,Ăn ngủ đúng giấc tự khắc lên cân
2034585983688185,Vi Vu,"Ăn chia bữa ra, ăn nhiều mà cơ thể k hấp thụ thì cũng thế"
2034607723686011,Nguyễn Tạ Thuỳ An,tẩy giun đi ạ :))
2034573770356073,Chu Hồng Phong,3 bữa chính + 2 bữa phụ + tập luyện
2034572410356209,Say Sữa,Đi tập thể thao cho khoẻ bạn ui
2034667893679994,Vy Nguyen,"Uống ensure nha, bao lên cân"
2034694553677328,Phong Thanh Tran,Có bạn trai em nhé
2034573837022733,Hoàng Tuấn Anh,đi khám xem ntn đã nếu bt thì tăng vận động để tăng trao đổi chất
2034620583684725,Minh Phương,"Ra hiệu thuốc mua men vi sinh dạng ống, mỗi ngày làm 2 ống liên tục ít nhất 3th, khi mỗi ngày bạn xì hơi tầm 5, 6 lần là b đã thành công"
2034582850355165,Dyn Kaa,"ăn và ăn thôi bạn, nếu bạn vui vẻ hạnh phúc ko stresss vấn đề gì thì dễ tăng hơn á, cùng chiều cao như bạn nhưng mà thấp lắm của mình là 43kg giờ thì được 53kg rồi bị mn quở mập rồi 🥲"
2034918853654898,Kim Yến Tỷ,"Mình cũng từng trải qua giai đoạn “ ma cây “, ăn bao nhiêu, ăn đêm cũng ko mập thậm chí sinh 2 con xong vẫn tong teo 😂. Nên chia sẻ cách tốt nhất và an toàn nhất cho bạn là hãy đi tập thể dục thể thao, bất kì bộ môn nào cũng dc , còn muốn độ body, độ dáng săn chắc khoẻ đẹp thì hãy tập Gym nhé, sẽ giúp quá trình trao đổi chất của bạn tốt hơn ☺️. Ở khu vực SG thì mình nhận hỗ trợ giúp chị e độ body luôn nhen 😉"
2034580867022030,Sang Đỗ,"1 là do bạn nghĩ bạn ăn nhiều, 2 là không phải do ăn chưa đủ nhiều mà ăn không đúng món, cứ ăn vặt linh tinh chưa chắc lên đâu"
2034637890349661,Mỹ Phú,Ăn 3 bữa chính (3 chén đầy) ăn thêm vặt nữa oki.. tối ngủ trước 12h... trưa ngủ 30p hoặc 1 tiếng.. k nên uống thuốc tăng cân nó có thể khiến bạn sau này gầy lại... Tui từng trải nè
2034577943688989,Diệp Thanh,"Ăn nhiều mà không lên cân là do bạn đang tưởng mình ăn nhiều thôi, phải tăng dần lên gấp 2, gấp 3 nữa.
1. Đi tập thể thao (bất cứ môn gì bạn thích) để cải thiện khả năng trao đổi chất.

2. Ăn, ăn và ăn. Chia nhỏ ra làm nhiều bữa ( 4 - 6 bữa mỗi ngày), đừng bỏ bữa sáng. Đừng ăn vặt mấy thứ linh tinh như trà sữa, bánh tráng trộn, oishi, bánh kẹo ngọt, đồ ăn nhanh,...những thứ nếu tăng cân sẽ tích một đống mỡ.
Những món nên ăn là cơm, sữa, sữa chua, trứng, thịt trắng, cá, bơ, chuối, rau xanh, trái cây. Đừng quên uống đủ nước.

3. Đi ngủ sớm, đừng thức đến 2,3 giờ sáng lướt tic toc nữa."
2034574717022645,Jun Hee,"Thôi đừng tim thuốc uống b ơi
Chăm tập td rồi ăn uống đi là lành mạnh nhất"
2034892896990827,An Bình,chị cao 1.55 nặng bằng em là đã bị nói quá trời rồi
2034599997020117,Bao Tram,Tuệ Giang
2034578220355628,Mai,Nguyễn Hậu
