comment_id,user_name,content
2030342597445857,Phan Thanh Truc,Bảo Pii Trà Phan ai r cũng sẽ vậy
2030416617438455,Đào Thị Hương Sen,Thảo Lêo
2030330914113692,Quỳnh Như,Trang Trang có vậy ko
2030328867447230,Lê Trần Linh Hương,Nguyễn Thuỳ Dương tưởng t k đó
2030596864087097,Sữa Dâu,Eric Tran a có ko
2030458387434278,Thanh Ngân,Tuyết Nhi có v ko ạ
2030338560779594,Cẩm Vân,Nguyễn Mai Thúy Hằng bần bần hèn hèn
2030427040770746,Ngọc Nhi,Long Lê Trần Ngọc Thiện dc cả quả combat vs nv thì ai bằng 🤡
2030454630767987,Ngoc Hau,Katie Gelber lướt lần nào cũng thấy giống e á Katie =))))
2030315320781918,Minh Tu Ngo,Bảo Li Linh Nguyễn y chang chưa
2030324117447705,Vũ Thu Thảo,Ngô Phương Thanh hài vl
2030316070781843,Linh Linh,Bảo Trân bảo trọng nha 🤭
2030315530781897,Ngọc,Cám Heo Bích Phương buổi sáng và tối😪
2030328274113956,Lưu Tuấn Đạt,Băng Băng suy luôn má
2030605354086248,Hồng Lực,Lê An tưởng ma k
2030409047439212,Thanh Thanh Lê,Mai Ngọc AnhPhong Linh chị nè =))))))))
2030398937440223,Thuu Thảo,Lê Hằng y chang cái nết
2030384700774980,Thu Ha Le,Tuyết Phạm thấy hình ảnh mình trong đó c ơi hâhhaa
2030369800776470,Hương Híp,Đinh Phương Lan e đó
2030591570754293,Dylan Ng,Triều Nguyễn nhớ đợt thử việc ở High land xong cái e té luôn :)
2030697780743672,Thanh Truc,"🔟 Lý do nên sử dụng máy lọc nước

👍Mang đến nguồn nước uống tinh khiết cho cơ thể
👍Loại bỏ các chất có hại, bảo vệ sức khỏe cả gia đình
👍Bổ sung các khoáng chất có lợi cho sức khỏe
👍Mang lại vị ngon cho nước
👍Giúp hệ tiêu hóa khỏe mạnh hơn
👍Hỗ trợ tốt trong việc làm đẹp
👍Giúp nấu ăn ngon hơn và cải thiện sức khoẻ hơn
👍Giúp loại bỏ tính axit của nước máy
👍Giúp loại bỏ các sản phẩm phụ clo và clo có trong nước
👍Tiết kiệm thời gian và chi phí

FPT Shop 344 Lê Văn Khương P.Thới An Q12 đồng hành cùng khách hàng giảm giá máy lọc nước cực sốc

🥰Máy lọc nước RO Sunhouse 8 lõi SHA8879K giá 6.590.000 nay giảm còn 3.590.000
🥰Máy lọc nước RO Sunhouse 7 lõi SHA8868K giá 6.290.000 nay giảm chỉ còn 3.390.000
🥰Máy lọc nước RO Kangaroo Infinity 9 lõi KG109I giá 6.290.000 nay giảm còn 4.790.000

☎️Liên hệ em ngay : 0937.874733 ( Trúc )

🌸Miễn phí giao hàng
🌸Miễn phí lắp đặt
🌸Miễn phí tư vấn"
2030352880778162,Võ Ðông Tuyền,"NẮNG NHƯ NÀY KHÔNG DÙNG SIÊU CHỐNG NẮNG X6 thì ôi thôi rồi => Siêu CHỐNG NẮNG x6 với 6 màn lọc chống nắng cao cấp phổ rộng vừa Chống Nắng - Dưỡng Trắng - Nâng tone tự nhiên-Che phủ tuyệt đối tại Làm đẹp cùng Mỹ phẩm Mairis bên em

- Chiết xuất từ hoa mẫu đơn hữu cơ giúp hỗ trợ chống nắng, bảo vệ da khỏi tác động bên ngoài, da bị ửng nắng thoa lên lập tức dịu ngay!
- Các thành phần chiết xuất nhân sâm, rễ cam thảo, linh chi, chiết xuất ngoc trai… vừa dưỡng vừa phục hồi, da căng mướt cả ngày dài, càng dùng da càng khoẻ đẹp!
- SPF 50+ và PA ++++ kết hợp cùng màng chống nắng đa tầng, giúp ngăn 99% tia UV gây hại! Bảo vệ da hoàn hảo suốt ngày dài!

Thích hợp với làn da dầu, da hỗn hợp, da đang bị mụn, da nhạy cảm, da sau treatment!"
2030352427444874,Võ Ðông Tuyền,"NẮNG NHƯ NÀY KHÔNG DÙNG SIÊU CHỐNG NẮNG X6 thì ôi thôi rồi => Siêu CHỐNG NẮNG x6 với 6 màn lọc chống nắng cao cấp phổ rộng vừa Chống Nắng - Dưỡng Trắng - Nâng tone tự nhiên-Che phủ tuyệt đối tại Làm đẹp cùng Mỹ phẩm Mairis bên em

- Chiết xuất từ hoa mẫu đơn hữu cơ giúp hỗ trợ chống nắng, bảo vệ da khỏi tác động bên ngoài, da bị ửng nắng thoa lên lập tức dịu ngay!
- Các thành phần chiết xuất nhân sâm, rễ cam thảo, linh chi, chiết xuất ngoc trai… vừa dưỡng vừa phục hồi, da căng mướt cả ngày dài, càng dùng da càng khoẻ đẹp!
- SPF 50+ và PA ++++ kết hợp cùng màng chống nắng đa tầng, giúp ngăn 99% tia UV gây hại! Bảo vệ da hoàn hảo suốt ngày dài!

Thích hợp với làn da dầu, da hỗn hợp, da đang bị mụn, da nhạy cảm, da sau treatment!"
2030318567448260,Phạm Nhung,tôi cũng thế kkkkka
2030353230778127,Tuyến Khuê,"NẮNG NHƯ NÀY KHÔNG DÙNG SIÊU CHỐNG NẮNG X6 thì ôi thôi rồi => Siêu CHỐNG NẮNG x6 với 6 màn lọc chống nắng cao cấp phổ rộng vừa Chống Nắng - Dưỡng Trắng - Nâng tone tự nhiên-Che phủ tuyệt đối tại Làm đẹp cùng Mỹ phẩm Mairis bên em

- Chiết xuất từ hoa mẫu đơn hữu cơ giúp hỗ trợ chống nắng, bảo vệ da khỏi tác động bên ngoài, da bị ửng nắng thoa lên lập tức dịu ngay!
- Các thành phần chiết xuất nhân sâm, rễ cam thảo, linh chi, chiết xuất ngoc trai… vừa dưỡng vừa phục hồi, da căng mướt cả ngày dài, càng dùng da càng khoẻ đẹp!
- SPF 50+ và PA ++++ kết hợp cùng màng chống nắng đa tầng, giúp ngăn 99% tia UV gây hại! Bảo vệ da hoàn hảo suốt ngày dài!

Thích hợp với làn da dầu, da hỗn hợp, da đang bị mụn, da nhạy cảm, da sau treatment!"
2030352784111505,Tuyến Khuê,"NẮNG NHƯ NÀY KHÔNG DÙNG SIÊU CHỐNG NẮNG X6 thì ôi thôi rồi => Siêu CHỐNG NẮNG x6 với 6 màn lọc chống nắng cao cấp phổ rộng vừa Chống Nắng - Dưỡng Trắng - Nâng tone tự nhiên-Che phủ tuyệt đối tại Làm đẹp cùng Mỹ phẩm Mairis bên em

- Chiết xuất từ hoa mẫu đơn hữu cơ giúp hỗ trợ chống nắng, bảo vệ da khỏi tác động bên ngoài, da bị ửng nắng thoa lên lập tức dịu ngay!
- Các thành phần chiết xuất nhân sâm, rễ cam thảo, linh chi, chiết xuất ngoc trai… vừa dưỡng vừa phục hồi, da căng mướt cả ngày dài, càng dùng da càng khoẻ đẹp!
- SPF 50+ và PA ++++ kết hợp cùng màng chống nắng đa tầng, giúp ngăn 99% tia UV gây hại! Bảo vệ da hoàn hảo suốt ngày dài!

Thích hợp với làn da dầu, da hỗn hợp, da đang bị mụn, da nhạy cảm, da sau treatment!"
2030320797448037,Trang Tran Ngoc,Kim Nhung cỡ e kkkk
2030587267421390,Christine Nguyen,Tàn tạ lắm bây
2030584584088325,Xuân Ngọc,Ảnh đầu chỉnh cà nát cái ápp.. tởm.
2030763237403793,Ngân Ngân,Hiền Suka
