comment_id,user_name,content
2017347785412005,Jake Long,Tammy Ngo :)) no defense
2016299492183501,Lương Thu Phương,Lê Diệu Linh😂😂😂😂
2018351855311598,Uyển My,Tram Lee nhớ bộ đồ mào xanh:))))
2016344592178991,Kim Loan,"Cơ hội nhận được bộ sản phẩm của nhãn hàng mỹ phẩm mới ra mắt KYUNGLAB

Nhập dữ liệu hàng hóa cho nhãn hàng . Tiền công 300k nhận ngay sau khi hoàn thành . Quan tâm Ib em tư vấn"
2015939335552850,Tuệ Linh,"Săn sale combo tẩy trang Bi.oderma 500ml + bông tẩy trang chính hãng, đủ bill Tmall giá chỉ 155k => https://www.facebook.com/groups/beauteland.deals"
2016023498877767,Châu Đặng,Huyềnn Thanh Thiển Thiểnn Trần Nhật Vy ai cưới trước 🫵
2015990245547759,Vũ Bảo Yến,Giống mk y chang
2016267112186739,An Nguyen,Nguyễn Xuân chắc t đó
2015860255560758,Thùy Dương,Gôn Bê hình ảnh của D 🤭
2016360332177417,Nguyễn Trần Quốc Vũ,"Bởi mấy bạn gái đừng có dại mà sinh con sớm nha :))
Cứ hưởng thụ sự xinh đẹp thiếu nữ của mình càng lâu càng tốt 😁"
2015942325552551,Nguyễn Việt Sương,"Y chang, cố quá thành quá cố"
2016069122206538,Nguyễn Cẩm Nhung,Đặng Bá Tuấn a ăn mặc kiểu gì thế hahaaaa
2018264405320343,Đặng Phương,Là tui nè :))))
2016033035543480,Sarah Trần,Sao giống tui quá vậy nè kkkk
2016023532211097,Alice Như,Dỡn quài
2016185168861600,Thu Diễm,y chang
2015920372221413,YuRyn,Nhi Huỳnh phải thặc xinh đẹp
2016518968828220,Lê Huyền Hà,Mai Ngọc :)))
2016200905526693,Thu Trang,Mình đã khóc khi đứng trước gương
2016243632189087,Phạm Thị Yến Nhi,Tàn ác😂
2015851072228343,Nguyễn Hoàng Yến Linh,Trần Lâm Bảo Trâm chúng ta của hiện tại
2015915075555276,Ntl Thu Lý,Y chang zị
2016092455537538,Nguyễn Tuyết,Quân Bùi ko thể thế này được
2015849828895134,Yuri Huynh,Má đúng chán. 🤥🤥
2018795788600538,Ruth Tố,"Top 4 loại kem trị mụn giá học sinh, lại còn được các bác sĩ da liễu khuyên dùng nên độ uy tín thì cứ phải gọi là ra dzẻ luôn nha mấy bà tại Alice’s Cosmetic đây ạ
=> KLENZIT MS: phù hợp với các loại mụ.n không viêm và m.ụn ẩn. Thích hợp cho các bạn điều trị m.ụn trứng cá và m.ụn mủ ở mức độ nhẹ đến trung bình.
=> KLENZIT C: do có thêm hoạt chất kháng sinh chống viêm (Clindamycin) phù hợp cho các nốt m.ụn sưng, viêm, mủ, bọc. Là sản phẩm thích hợp cho các bạn bị m.ụn nặng.
=> MEGADOU GEL: Là một ứng cử viên hoàn hảo trong việc điều trị các vết thâm dạng m.ụn bằng cách làm khô cồi, ngăn ngừa các loại m.ụn viêm, trứng cá và các đốm hắc tố hình thành sau quá trình điều trị, giảm thâm mụn hiệu quả
=> DERMA FORTE: trị mụn nhẹ, giảm thâm m.ụn hiệu quả vừa có tác dụng dưỡng ẩm, sáng da.

- - - - - - - - - - - - - - - - - - - - -
- Alice’s Cosmetic
Shop online in HPC
Uy tín tạo thương hiệu !
Nói không với hàng FAKE !
Ship COD toàn quố"
2015848485561935,Thanh Huong Nguyen,Xju Pé m có bị cảm giác này ko huhu
2015872595559524,Phạm Hồng Ngọc,Hồng Hạnh c Hạnh đánh giá sao về trường hợp này 🤪
2015894522223998,Lê Thu Trà,Hoài Phương mặc gì cũng thấy sai sai =)))))
2015865372226913,Nguyễn Vy,"Cẩm Tú y như c. Mé ơi, tức á"
2016274355519348,Ken Nguyen,Huong Nguyen mẹ Ti thích màu Hồng hahah
2015908905555893,Kim Thảo,"Nè, thôi tự đẻ dùm mình nha Trần Thiện"
2015866575560126,Lý Kim Thoại Anh,Y chang luôn á trời 🤣
2015854185561365,Linh Dương,Sao giống dữ v chời kkk
2015892658890851,Kim Nana,Đinh Ngọc Hồi là tao 😀
2016006198879497,Lê Ngọc Bình,Là teo mún ngựa cũng ngựa k dc .Mặc gì không biết nhưng con đói phải dỡ ra cho bú liền 🤣🤣🤣
2015943038885813,Nguyễn Hà Trâm,Ronpi Nguyễn giống ấy quá 🤣
2015848368895280,Hiền Suka,Ly Nguyễn iu màu hường ghét sự giả giúi
2018277121985738,Trà Mee,Hồng Vân t đã hĩu vì sao mn cừi t mặk đồ hồng kẹp tók hồnk
2015894348890682,Trương Lam Ngọc,Rosie Trương giống chị thân yêu của em quá 😏
2015955905551193,Xuân Vy,Toai đã cố gắng hết sức :)
2016257465521037,Trang Le,Thuỳ Duyên thật vô nghĩa😂😂😂
2016292602184190,Hương Vũ,Quang Minh🤣🤣🤣.đã cố gắng hết sức🤣
2016300858850031,Tiểu My,Hà Trinh chúng ta đã cố gắng hết sức rồi 😂
2016292988850818,Trang Dang,Đức Trịnh 🥹 em nè thấy huông em hông
2015896828890434,Phương Bé,K thể xinh đẹp nổi
2015912782222172,Hồng Phương Nguyễn,Lê Thành Đạt
2016372908842826,Bao Tran Le,"I dị đó trời, bạn bè thì đẻ xong ốm nhách thon gọn chỉ có dú bự thui còn lại ngon vcl. Còn tao mặp ù xong ăn bận dim dúa hồng r disney rồi h săn labubu đeo dô giỏ nữa trời ơi cú i."
2015975738882543,Tram Nguyen,Nhung Luu
2015847385562045,Minh Phùng,Ít ra cũng từng xinh đẹp
2016347422178708,Ngân Chu,My Chu ráng xinh đẹp
2016328298847287,Bửi Bửi,:) đcm cay vl
2017047818775335,Ngọc Lan,Bùi Thành Đô giống vợ thế nhỉ 🤣
2017221602091290,Võ Hoa,Móa buồn nha 😭
2016319672181483,Như Quỳnh,Nguyen Hien cũng đẹp 🤣
2017032102110240,Diễm Quỳnhh,Ơi là chời 😂
2015875088892608,Lý Khánh Ngọc,))))))))) Shrek hề
2017775155369268,Thảo Linhh,Mai Uyen Nguyen k có con nhma nhìn buồn cười vl :))
2015915402221910,Ý Nhi,Võ Hương bắt chước liêng
2015861235560660,Li Lee Tran,Ngoc Nguyen hình ảnh đôi ta
2015948455551938,Vy Nguyễn,Kim Xuân Lê Phan sau cũm dị
2016338515512932,Bích Hường,Đỗ Duy Khánh mua cho bộ này mặc 🤣
2015967575550026,Hoàng Khánh Chi,Có cố gắng nhưng ko đáng kể 🥴
2016193532194097,Phạm Mai Trinh,t á
2017049685441815,Triệu Quyên,Khương Quang Khải 🤣🤣 cố gắng lắm rồi đấy
2015884322225018,Huyền Phương,Choán
2015867958893321,Nguyễn Đỗ Hoàng Điệp,Châu Châu thì ra đây là lí do dạo này t thích màu hồng 🤣
2016304385516345,Như Huỳnh,Giống m á Tí Quạo
2015860182227432,Hàn Anh,Minh Khiêm Đoàn cái má hồng của c á c
2016246268855490,Huy Đức,Quỳnh Phạm chúc bạn may mắn
2015932685553515,Bống Bống,Chả có nhẽ🙃
2016185292194921,Carmen Truong,Grace Ngo sắp tới nè haaaaaaa
2015944422219008,Vũ Hải Linh,Phương Chi Phương Thảo :)) tl các c
2016389835507800,Linh Trần,Hồng Thu xinh dữ chưa nè😚
2016184378861679,Thanh Thảo Ngô,Ulatroi
2018476478632469,Duong Phuong Anh,Duong Phuong Linh ai đó khi thích váy sequin
2016820198798097,Nguyễn Quỳnh Anh,Hoàng Xuân Khánh trời má thật luôn 🥲
2018262891987161,Phạm Minh Thư,Diệu Hương tag lộn
2016240632189387,Na Mini,Tiên Nguyễn cũng xinh mà hơi rê 🥲
2016003672213083,Thương Thương,Trịnh Đan Trường tôi đau đớn tôi gục ngã
2018625798617537,Trần Ngọc Bảo Quyên,Kim Chi c có snghi này k
2015940812219369,Hatha Nguyen,Oanh Lâm Thảo Quyên có cố gắng nhưng không đáng kể 🙂
2016388328841284,珍美,Trần Bình thật toẹt zời 🥹
2016442085502575,Ng Ngoc Mai,Nguyễn Bảo Trăm vẫn đẹp nhỉ 🙃
2017644975382286,Ng Gia Ân,Dũ Nguyễn zô nghĩa
2015854835561300,Huynh Thien Di,có cố gắng nhưng ko đáng kể Nguyễn Quyên
2015883952225055,Phương Hiếu,Mỹ Duyên bà phải ko
2016415418838575,Quỳnh Võ,Võ Cẩm Quỳnh Như chị cẩm hường
2016265805520203,Nhi Nhi,Lê Hòa Lien Nguyen chính lieennn..là liên 😁☺😁
2017660858714031,Bảo Nghi,ủa bà kìa Angel Như Huỳnh
2016011692212281,Thuỳ Moon,Nguyễn Thảo Nhi kkkkk em của tương lai
2015869048893212,Nhung Pham,Tố Uyên giống k? 😥
2017564415390342,Vanh ST,tao đó :)))))
2015852565561527,Trần Phát Diệm,Tram Anh Vu ai vậy
2015873275559456,Lưu Thùy Trang,Luan Van Anh adh2 đấy
2015889245557859,Tiffany Pham,Viviane Dam =))) đây nà chị à
2016022452211205,Bún DuLa,Khánh Ngân tỉnh táo lên mqnn
2015898005556983,Trần Thị Thu,Tui lun 😌
2015875888892528,Nhâm Thị Quỳnh,Quỳnh Nga sắp rồi 🤣
2016284998851617,Kiều Phạm,Hoàng Trúc Anh moá kkk
2015864465560337,Hồ Khánh Huyền,"2✅✅Nhóm mình anh chị nào bị lừa tiền qua mạng, qua ứng dụng telegram không rút được. Đang sợ gia đình phát hiện không dám nói chia sẻ với ai thì nhắn cho em em chỉ cách lấy lại, sẽ mất phí nhưng sau khi lấy lại tiền về tài khoản mới trả phí✅"
2016654995481284,Tring Min,Min Min kkk
2018422501971200,Nguyễn Trâm,Nhân Nguyễn Nhân
2016256648854452,Tiểu My,TuAnh Mks ác 😆😆😆
2015916222221828,Ngoc Anh Nguyen,Bùi Tiến Đạt :))) sự thật phũ phàng
2015879785558805,Trương Ngọc Vân,Lili Nguyễn bạn 👯‍♂️ nè 😂
2016699562143494,Võ Đinh Văn Duy,Bim Zít meme nè
2016588692154581,Tuyết Nhi,Thanh Huyền gì nè
2015859655560818,Hải Nguyên,Nguyễn Thị Khánh Hòa gu H nè H ơi 😊
2017627185384065,Minh Nguyệt,Trần Vũ Giang nói j đii
2015959785550805,Thu Hà,Lan Anh chị đấy à kkkk
