post_id,user_name,content
1634043370729255,Qer Phuc Thinh,"Cảm nhận & Rì viu chi tiết về con tablet lenovo y700 của e sau 2 tháng sử dụng :v cũng như ưu và nhược điểm trong việc sử dụng máy tính bảng android trong việc học.
Chào các bác, trước đây e có rì viu nhẹ con tab này lúc em mới mua về, và sau gần 2 tháng sử dụng để làm việc, giải trí, với tần suất liên tục thì em có đôi lời nhận xét về con tab này như sau :
À à nếu như các bác chưa biết thì em đang dùng con tablet lenovo legion Y700 2022, thông số trong hình nhoé các bác :v
Chức năng và sử dụng
Nói về chức năng sử dụng, thì mục đích ban đầu khi em sắm tablet về là để HỌC. Và phụ là giải trí- xem phim. Em hiện đang học thiết kế đồ họa, hệ đại học nên em cần phải có một thiết bị máy tính đủ mạnh, và một bảng vẽ điện tử để phục vụ việc học và làm liên quan đến chuyên nghành. Máy tính thì em đang có 1 con laptop gaming cùng. Bảng vẽ wacom S, nên về cơ bản là em đang có đủ. Nhưng vì dạo này trời sg đang vào mùa mưa, cộng với việc vác 7kg đồ dùng học tập bao gồm lap, wacom và bút màu linh tinh đi học khiến em thấy hơi quan ngại. Rủi trời mưa to mà em còn mang theo máy móc nữa là hỏng hết cơm cháo :v. Nên em sẽ thay thế bằng con tab Y700 này thay cho đống bút màu tập sách, laptop bảng vẽ kia là hợp lí cmnl.
Trong vòng 2 tháng nay, em cảm thấy con tablet đang đáp ứng rất tốt với vai trò là công cụ tổng hợp, nó thay thế gần như 80% dụng cụ và máy móc em mag trong balo trước đây. Trước đây em mang tính tròn lên là 8kg, mỗi ngày đi xe 38km đến trường, thì giờ đây balo của em nặng còn có 1,5kg. Rất tiện và rất khoẻ.
Trong quá trình học, thì em dùng nhiều nhất là nhu cầu gõ văn bản, nhu cầu vẽ phác thảo ( sketch ) và design cơ bản ( edit slide thuyết trình, edit logo và con dấu. ). Không nằm ngoài sự mong đợi, con tab này nó đáp ứng 90% nhu cầu của em. Viết và vẽ em có picsart, nebo, edit em có canva, capcut, desygner. App nào cũng dùng rất tiện, rất mượt. Một vài app design và ghi chú có tính phí thì em tải mod apk trên internet, và thế là có app xịn xài chùa, quá đã 😝( ko khuyến khích xài chùa ). Còn app nào bắt mua gói tháng thì em đi xin slot cõng free của các xiên thủ, trick lỏ thủ. Cùng lắm tốn gói cafe 15k là có team premium 99 năm xài thoải mái ( em cũng k khuyến khích cách này nhoé ) :V app duy nhất mà em chịu trả phí là youtube prem1um 1 tháng 60ka.
Nhiều khi trong tiết thầy cô ra đề sketch cái gì đó, hay có bài tập cần dùng máy thì em chỉ cần mở app nebo hoặc canva, import file AI vào là edit thoải mái tẹt ga. Trong khi ae bên cạnh tụi nó còn tìm ổ điện để cắm sạc cho laptop. :v
Hết học rồi thì tới lúc giải trí. Em là người có size tay nhỏ, em nói thật nếu chơi mấy game chiến thuật như rise of kingdom, hay võ lâm truyền kì,TFT hay tiệm lẩu đường hp, mấy game chỉ cần 1 ngón là chơi đc thì cái tab này phải gọi là thiên đường luôn :v màn hình 8.8 inch to, độ sáng cao, chơi thấy rất đã, ko bị mấy cái nút thao tác hay frame Ui nó che mất màn hình làm gò bó như chơi trên đt. Nhưng mấy game fps, moba như lữa chùa, genshin, liqi hay lol wildrift thì người tay nhỏ như em chơi khá cực. Màn hình nó to nút nó cũng to theo, lại còn nằm ở góc rìa nữa thì lúc chơi 2 ngón cái phải rướng rướng lên màn hình liên tục, rất mỏi tay. Chưa kể cái tab nó to 8,8 inch nên 2 tay em ôm ko trọn, lúc chơi lq muốn lây đồ thì phải bỏ tay ra khỏi nút di chuyển xong đưa tay lên 1 khúc mới bấm lấy dc, khá khó chịu. Em nghỉ ai tay to thì chơi game fps- moba trên con này mới đã. Tay nhỏ khổ vkl. Còn về hiệu năng và fps thì em khỏi bàn :v vì bản thân con lenovo legion tab này nó là tablet gaming r, chơi game nào mà để setting dưới ultra hay dưới max là 1 sự xúc phạm với con tab này :v
Ngòai chơi game ra thì xem phim cũng là 1 trãi nghiệm 10 điểm cho em tab. Màn nó là màn ips lcd độ phân giải cao, tần số quét 120hz, độ sáng 500 nit, màu tương phản cao, đen sâu nên khi em netflix có thể xem ở độ phân giải full HD. Màn lên màu rất đẹp,màu đen rất sâu. Nó cho em cảm giác như hao hao giống mấy con màn oled hay retina ấy, ko có cảm giác như mấy con màn lcd hay bị hở sáng :v. Thêm cặp 4 loa jbl trong 2 khe viền nó hét như mấy con loa bt nhỏ, nhiều khi em lướt tiktok mà quên để âm thanh xuống mức 30% là load nó la đủ to cho cả nhà nghe, ngại vl.
Ps : con màn này có chức năng thái dương năng của dáo sư đạt dăn tây, nếu các bác xem mà để máy cách xa khoảng 30cm tầm mắt ( cầm kiểu cầm sách đọc ấy ) là khi môi trường càng tối, màn càng sáng 🤣 môi trường càng sáng, màn nó nhỏ độ sáng vừa cay vkl. Chỉ khi các bác để cách mắt dưới 30cm ( kiểu cầm đt nằm lướt tiktok ấy) thì nó mới nhỏ độ sáng theo đúng môi trường. Trời càng tối độ sáng càng thấp. Màn bình dương vkl
Cảm giác cầm nắm & công thái học
Không :)) công thái học cái qq. Tab nó vát vuông góc như iphone 12 ấy, được cái ngta còn mài góc 1 tí đi nên cầm đỡ đau tay, nhưng cảm giác cầm nó vừa mỏng, vừa trơn cho em cảm giác lo sợ nó rớt mất ấy :))) em phải mua 1 cái ốp độn vào cầm nó mới đủ đằm. Chứ cầm máy trần máy nó vừa trơn, vừa mỏng cầm e thấy lo sợ vl. Tab này nó được thiết kế để chơi game 1 cách tiện nhất, nên loa, jack tai nghe và cổng sạc người ta để hết về bên phải, chừa 1 nữa cạnh dọc của máy trống không nên cầm chơi game rất tiện. Cắm tai nghe hay sạc 0 bị vướng tay, loa ko bị tay bịt rè.
Tóm lại là tác vụ bình thường thì cầm như cớt, nhưng chơi game thì thế tay rất ok 🤣
Thay đổi hoặc biểu hiện liên quan đến phần cứng & phần mềm
Về pin và kết nối mạng, thì mang tiếng là tablet nhưng máy có cục pin hơi lỏ, chỉ có 6k5 mah. Nên nếu chơi hame liên tục thì em nghĩ 8 tiếng là cạn pin. Còn dùng hỗn hợp thì phải mất 14 tiếng máy mới báo 15% pin. Tuy pin hẻo là thế, nhưng máy đc gắn chip sạc nhanh 55w, nên chỉ cần cắm sạc trực tiếp tầm 30p là máy báo 80% rồi. 40p là đủ 100% để sài cả ngày, em sạc giáp vòng sài rất ok. Còn nếu cắm vào pin dự phòng thì máy chỉ active công suất 22w, sạc 30p nó nhảy lên 60%, 50p mới đầy pin. Còn kết nối mạng thì do máy chỉ có wifi 5g, ko có sim nên em dùng đt share wifi qua cho máy sài. Cũng ok ko vấn đề gì. Ngoài ra máy bắt sóng rất tốt. Em ngồi học ở tầng 3 còn có thể bắt doc wifi khu hành chính trường ở tầng trệt, tuy wifi chỉ 1 vạch.
Về phần mềm thì em boot từ Zui thuần của máy sang Miui Pad rom EU để sài, vì Miui Pad có tiếng việt 100%, bản đồ đầy đủ chủ quyền vn. Miui sài trên máy rất mượt. Hình như kĩ sư củ Mi làm cái miui để sài cho mọi loại thiết bị adr hay sao ấy, em thấy thiết bị nào chạy adr sài miui cũng mượt :v. Nhược điểm của phần mềm là nó đã root, nên ko sài đc app ngân hàng và 1 vài game lẻ như minecraft nếu tải trực tiếp trên ch play. Còn lại thì ko có nhược điểm nào hết.
Tóm lại & Ưu và nhược điểm khi sử dụng máy tính bảng thay laptop trong thời gian học đại học.
Tóm lại, nếu các bác cần 1 thiết bị thay thế laptop- máy tính cồng kềnh tạm thời thì tablet android hay con y700 này nói riêng là 1 sự lựa chọn hợp lý. Nhưng để thay 100% thì chưa thể. Có nhiều phần mềm vẫn cần máy tính mới có thể phục vụ dc.
Còn về nhược điểm khi dùng ipad- tablet chắc em nghĩ là tài chính :v 1 con tablet hay ipad sài đc, đáp ứng đủ nhu cầu thì giá ko hề rẻ. Loanh quanh 8-15m nếu là sp phân phối 9 hãng tại Việt Nam, hoặc 7-10m cho sp xách tay như của e. Nếu các bác dư dả tài chính, hoặc cần thật thì hẵng mua. Mấy con này nó vẫn chưa thay thế hoàn toàn thiết bị pc đâu nhé các bác :v nếu các bác chưa có pc hay laptop thì 7-15m là đủ cho 1 con thiết bị pc ngon. Còn có r thì hãng mua tablet."
