comment_id,user_name,content
1962325407580910,Nguyễn Quý Lâm,"chị đi da liễu với spa mất 1 đóng tiền mà hết liệu trình là mụn lên ầm ầm , trước e chót dại đi gà spa =]] hết liệu trình 1 tháng nó nổi lên như được mùa"
1962354130911371,HaLy Phạm,"- Thứ 1: Mụn ẩn sần sùi, kích viêm thâm mụn các kiểu như này thì nền da phải luôn thật sạch sâu ( Xem lại bước làm sạch thật kĩ nhé 👌 )
=> Em Peel định kỳ nhẹ nhàng để thông thoáng lcl & ăn dưỡng hơn nhé

- Thứ 2: Duy trì với Hoạt chất ( Đặc Trị Mụn)
Kết hợp Phục hồi + Cấp ẩm đủ đô để da luôn khoẻ, khô cồi nhanh & tránh bị kích viêm như này e nhé

=> Và Routine như nào cho hợp lý nữa nhé☘️,,"
1962314794248638,Quynk Link Chi,Ib mình tư vấn
1961602164319901,Lê Ngọc,"Bạn thêm bước tẩy trang bằng dầu tt hằng ngày , nhũ hóa rồi massage thật kĩ để làm sạch lcl , t đang áp giúp và giảm sợi bã nhờn , mụn ẩn cực hiệu quả. Và bôi thêm em Actiderm này nhé có Bha , AHA giúp làm sạch lcl , điều trị mụn li ti ,mụn đầu đen cực tốt ạ. 2 sp này t đang dùng thấy siêu hiệu quả , giá cực kì hssv thôi ạ. Bạn có thể tham khảo ạ đắp thêm mặt nạ đất sét 2l 1 tuần. Mua loại himalaya này nè đất sét có thêm lá neem giúp sạch da , giảm dầu thừa cực tốt luôn á giá hssv
Tẩy trang Kose c lấy bản deep nhé :
https://shope.ee/3L2s7tnEgT
Mặt nạ himalaya :
https://shope.ee/3L2zAAgxaS
Actidem:
https://shope.ee/2AsCpHyDw8"
1961646067648844,Leyla Nguyen,Có thể spa cho bạn dùng kem trộn bạn nên tối giản skincare dùng kem mụn với mụn ẩn dùng megadou viêm sài klenzit c tui lúc bị chỉ bổi vào cục mụn chứ ko bôi cả mặt
1963526440794140,Gái Họ Nguyễn,Ở nhà thuốc chỗ em cũng kê cho khách nhiều đơn về mụn như này và đều khỏi rồi. Nếu chị quan tâm và tin tưởng thì có thể nhắn tin qua cho em để em tư vấn ạ
1961957980950986,Ly Liếu Láo,T củng bị vậy do sài kem tào lao nè giờ đơn giản thôi sẽ giảm mặt t giờ giảm rõ mừng hết lớn
1961914460955338,Anh Thu Nguyen,Ui mặt bạn giống mình lúc trước ý. Có khi bạn chưa xài đúng sản phẩm phù hợp và làm sạch chưa kĩ đó bạn 🥹
1963238427489608,Dương Thu Hà,"Giống mình thế nè 😂 cũng đi da liễu rồi spa xong retinol các kiểu vào xong chả đâu vào đâu. Cuối cùng, chỉ có 3 bước đơn giản mà khoảng 1 tháng rưỡi da mình nhẵn đẹp lại rồi. Còn 1-2 vết thâm chưa mờ hẳn thui"
1961599367653514,Nhy Nguyễn,Em nghĩ ko biết về việc tâm linh gì hay ko nhưng nhỏ đến lớn em chưa từng bị qua như vậy. Da em trước giờ trộm vía là rất khoẻ. Nhưng từ ngày con bé làm cùng phòng em nó khen da m.ặt e đe.p thế là đúng 3 ngày sau m ặt e nó ko hiểu nguyên do gì nó lên mụn đến giờ là đc cũng gần 3-4 năm rồi. Năm đầu tiên e có mua thuốc tiện thuốc tây nghĩ là dị ứng. Em uống thì hết ngưng thì lại lên. Dòng dã uống tận 5-6 tháng thì lại khỏi đc tầm 1 năm ko lên. Xong rồi nó lại ồ đến e ko uống thuốc nữa.E đi da liễ u và spa có điề u tr ị kiểu gì thì nó cứ nhảy cả m như trên ạ. Haiz.
